{
  "schema": "aipt.public.authority-lifecycle-record/v1",
  "record_id": "INT-AIPT-UNREGISTERED-MVP-001-CLOSEOUT-AUTHORITY-001-CLOSEOUT-001",
  "task_id": "INT-AIPT-UNREGISTERED-MVP-001-CLOSEOUT-AUTHORITY-001",
  "semantic_artifact_identity": {
    "task_id": "INT-AIPT-UNREGISTERED-MVP-001-CLOSEOUT-AUTHORITY-001",
    "artifact_id": "INT-AIPT-UNREGISTERED-MVP-001-CLOSEOUT-AUTHORITY-001",
    "artifact_path": "docs/authority/amendments/INT_AIPT_UNREGISTERED_MVP_001_CLOSEOUT_AUTHORITY_001.md",
    "artifact_sha256": "54b3146502faf2447ffea95c1feb4d41d4ecfbc1bb8adf17b527ef8d5c5dd8db",
    "candidate_commit": "ee815ab50db04a4ef18a941a68e9e8ecae5c8aa2",
    "candidate_tree": "f2a5c84809df57f2ae7c858f025f6b8b7abfd334",
    "semantic_snapshot_state": "CANDIDATE_FROZEN",
    "semantic_snapshot_accepted": false
  },
  "event": "CLOSED",
  "event_sequence": 3,
  "predecessor_lifecycle_record": {
    "record_id": "INT-AIPT-UNREGISTERED-MVP-001-CLOSEOUT-AUTHORITY-001-LIFECYCLE-002-POST-MERGE-VERIFIED",
    "record_sha256": "46e7d6dc473c3e5e6fdd428f9283f06725531dedb2113332e4f22fdc012daea6"
  },
  "authority_basis": {
    "model_id": "IMMUTABLE_SEMANTICS_APPEND_ONLY_LIFECYCLE_V1",
    "authorized_by_task": "INT-AIPT-UNREGISTERED-MVP-001-CLOSEOUT-AUTHORITY-001",
    "authorization_kind": "ACCEPTED_LIFECYCLE_MODEL"
  },
  "event_evidence": {
    "kind": "GOVERNANCE_CLOSEOUT",
    "closeout_identity": {
      "commit_source": "CONTAINING_GIT_COMMIT",
      "governance_only": true,
      "owner_authorized": true
    }
  },
  "record_identity": {
    "identity_scheme": "IMMUTABLE_GIT_BLOB_AT_ACCEPTED_COMMIT",
    "path": "docs/authority/registry/authority-lifecycle/records/int-aipt-unregistered-mvp-001-closeout-authority-001/003-closed.json",
    "accepted_commit_source": "CONTAINING_GIT_COMMIT",
    "append_only": true
  },
  "created_by_task": "INT-AIPT-UNREGISTERED-MVP-001-CLOSEOUT-AUTHORITY-001",
  "provenance": {
    "source_task": "INT-AIPT-UNREGISTERED-MVP-001-CLOSEOUT-AUTHORITY-001",
    "source_commit": "f0a8c3e5db88e2ca33089e8db9cabb74b4cecfdb",
    "source_tree": "f2a5c84809df57f2ae7c858f025f6b8b7abfd334",
    "record_creation_authority": "INT-AIPT-UNREGISTERED-MVP-001-CLOSEOUT-AUTHORITY-001",
    "record_creator_task": "INT-AIPT-UNREGISTERED-MVP-001-CLOSEOUT-AUTHORITY-001",
    "historical_evidence_claimed_only_if_proven": true
  },
  "effective": true
}
